reviewId,userName,userImage,content,score,thumbsUpCount,reviewCreatedVersion,at,replyContent,repliedAt,appVersion
1603808f-c584-473b-b9dd-62ee65107bad,Amanda Yureika,https://play-lh.googleusercontent.com/a/ACg8ocJUBb24_731DrKdWYvw2KX-bDd4wFCR6qJFYktP0_WBtpo67w=mo,"Sudah update 2x tapi progam beta sudah penuh,dan kok gak bisa bikin status yg ada musiknya. Lalu apa fungsi update terbaru klo gak ada perubahan",4,0,2.25.6.74,2025-03-14 22:39:31,,,2.25.6.74
479d6853-f420-4bf9-ac7e-2478226dae95,AISA DIARA,https://play-lh.googleusercontent.com/a/ACg8ocJrhOHO0zTPkLPp1fIK5h8ScOth5zhjOSj5oQdIkcviaoa5Ajs=mo,"yang lain udah bisa keluar musiknya punyaku udah di update 3x belum keluar juga musiknya , padahal gelembung chatnya udah keluar lama",1,32,2.25.6.74,2025-03-16 02:09:02,,,2.25.6.74
8f6dcec3-99aa-44bc-8f94-0545ef0c2458,Dimas Oppo,https://play-lh.googleusercontent.com/a/ACg8ocKWHaXHe1D2T49_mIXRoxAnY2P04iFMbzniLWtXV5zuIb_8eg=mo,"kenapa kalau buat story tidak ada fitur musik, sedang kan aplikasi wa yg lain udah pada ada fitur musiknya . apakah merek hp berpengaruh",2,0,2.25.6.74,2025-03-14 01:02:40,,,2.25.6.74
61a66d5e-e391-4103-a392-f7a394b07641,Acilmic,https://play-lh.googleusercontent.com/a-/ALV-UjXcrbvPvTZ_Cft_laP29mqjsL4OoalyNGrhBvwnGS1t4abEQDKR,"kenapa WhatsApp saya tidak bisa bikin status poto di tambah lagu dari WhatsApp? kenapa temen"" saya ada lagu nya kenaa saya tidak ada padahal udah di update tolong benerin dong",1,0,2.25.6.74,2025-03-15 04:28:41,,,2.25.6.74
0e84f3f9-8ea2-4126-b28c-d99b4288e0d9,dinda ngrha,https://play-lh.googleusercontent.com/a-/ALV-UjWO7mDope1lzMY4ptEtWIBBTI5lv5Q0zQ-4h_h_k60U5bwA5HzQ,"udah di update 2 kali, tetep aja gk ada musiknya, gimana sih, sampe diketawain temen"" gara-gara wa gue gk ada musiknya, giaman dong ini!!!!! udah cape sama wa skrng",1,1,2.25.6.74,2025-03-16 11:25:36,,,2.25.6.74
f94d8870-c441-4984-8543-b2c0fda976d9,Atyaditya Brahmadatta,https://play-lh.googleusercontent.com/a-/ALV-UjWWc4msioDCo0aH7mafsW94qgTMzF5dFPNKKsvnFL5hEDakYKroIw,"TOLONG PIHAK WHATSAPP AGAR SEGERA PERBARUI WHATSAPP DI PERANGKAT SAYA INI. KARNA ADA FITUR BARU YANG BELUM BISA SAYA GUNAKAN SEPERTI FITUR (MUSIK) TOLONG DIPERANGKAT SAYA SECEPATNYA AGAR BISA DIPERBARUI WHATSAPP INI !!! Note: Saya kasik bintang 2 dulu, setelah saya bisa menyoba fitur baru dari WhatsApp baru saya kasik bintang full ⭐⭐",2,1,2.25.6.74,2025-03-14 03:14:22,,,2.25.6.74
7576339a-ee8e-40bb-9a62-82803524f9a9,Topik Typ,https://play-lh.googleusercontent.com/a-/ALV-UjXZcjubhBCex4kz188Hf37OtovtWmFE8bC2NSc0bzil_-6JYVsg,munkin hanya segini dulu karena saya sudah mengupdate aplikasi ini tetapi saya tidak mendapatkan fitus terbarunya yaitu fitur tambahan musik di status jadi saya mohon agar saya bisa mendapatkan fitus itu. Terima kasih🙏🙏🙏,3,0,2.25.6.74,2025-03-14 13:08:39,,,2.25.6.74
85953925-2572-4876-9a8a-c9ee1b0a2fe7,Dian Islamia,https://play-lh.googleusercontent.com/a-/ALV-UjURBLqKfhMCQpRPt50WoKOebzP1WtleEOFfJJhUPMMQIFyU8ho,Orang² wanya ada fitur musiknya. Saya udah di update 2x tetep aja gak muncul fitur musik 🤧,1,0,2.25.6.74,2025-03-15 08:56:37,,,2.25.6.74
ff0384a8-fd83-48fc-9b22-fd5cc93334ed,dennis radityaa,https://play-lh.googleusercontent.com/a-/ALV-UjVZfyYQE8-hebGOeRb7qduMjqpY4AnTatyBYNkb6UYFRmJlOAY,Fitur musik baru si story Wa nya tidak muncul padahal sudah di update dan ikutin berbagai tutorial tapi masih ga bisa,1,0,2.25.6.74,2025-03-15 02:05:11,,,2.25.6.74
29ae791b-42d9-4ac1-968a-515e90c34a13,Cecillya Khaira,https://play-lh.googleusercontent.com/a-/ALV-UjUxLmEPGAY1WJ5GNWeZ_hnPbMpHvm0jDkOhR2XEetuv8VwYsmk,"sorry gabisa kasih Bintang penuh, ini wa udah update 2 kali trus yang katanya bisa pake LAGU tapi ini aku update gaada juga.. gimana sih?? tolong perbaiki dongg aku sampe restart2 hp cuma biar ada bisa pake LAGU doang",3,0,2.25.6.74,2025-03-16 08:07:55,,,2.25.6.74
8e9ec0d4-2055-433f-a625-42057bb0c94c,Erdha Wati,https://play-lh.googleusercontent.com/a-/ALV-UjVfPAN7yXnuoyU9aypyry0mnyQ9v5rpdd_x1G8Zz1C6A020FD_f,"Punya temanku whatsapp nya ada. Fitur musiknya kenapa di whatsapp ku gk ada fitur musiknya,, padahal udah di upgred ke persi yg baru? ?",4,1,2.25.6.74,2025-03-15 08:24:53,,,2.25.6.74
13da6e0a-95ca-4310-8e74-2169507966e2,Asep Jampang,https://play-lh.googleusercontent.com/a-/ALV-UjV0BYZQybl4qmERuMajCZ14CoKGakfo1tUoqr4cNaRcZ-lnjNIw,"saya kurang suka tampilan yang sekarang pembaruan statusnya seperti facebook, aku lebih suka versi yang lama, jadi aku kasih bintang 1 aja.. saran saya biarkan whatsaps punya tampilan cirihas sendiri tidak usah seperti facebook..",1,1,2.25.6.74,2025-03-15 14:20:54,,,2.25.6.74
35504b28-b1ff-47de-ac89-bdb38c36571d,Linda Susanti,https://play-lh.googleusercontent.com/a/ACg8ocKZlAHTGRt92hhP105R7tU0Gz6KoygJgk9kCF0g0dQDBpJgPg=mo,"Udah di update tapi ga muncul² fitur² barunya kayak musik, gelembung chat. Malah beda sendiri hp saya sama kayak punya orang tua saya mereka udah ada fitur barunya kenapa hp saya ga ada padahal merek hp sama. Bingung saya",2,1,2.25.6.74,2025-03-13 19:51:05,,,2.25.6.74
03d6b274-4a1b-4216-9ad9-dc1e3666552d,Mewin Gea,https://play-lh.googleusercontent.com/a-/ALV-UjWCGJWWSIT8wal4bXHg9lwGzjWmg73QDE0wf_irOxUQe13JrydVVw,"Whatsapp semakin bagus sih. Kalau bisa story teksnya dibuat seperti Instagram juga dong, teksnya bisa beda warna.",4,0,2.25.6.74,2025-03-16 01:09:52,,,2.25.6.74
1d9c125a-9ccb-4f32-80ca-c235a41d061d,lutfi hizbullah,https://play-lh.googleusercontent.com/a-/ALV-UjWSizvvtIyluyu8BALgI0I-yIU4ab6b-M0-9NGMrjAoJfkDBAlT,Untuk Whatsapp tolong untuk memperbaharui fitur chat audio yang ada di group karena sangat menganggu.... Ataupun melakukan pembaruan untuk chat audio untik bisa di atur oleh ADMIN terimaksih semoga menjadi acuan🙏🙏,5,1,2.25.6.74,2025-03-13 18:39:11,,,2.25.6.74
4bc9d33a-96ec-491a-b19f-1218cbaa7c91,Muh. Ashabul Kahfi Saputra,https://play-lh.googleusercontent.com/a-/ALV-UjW16f4MfgOx8A2ll4EDzrLlnCAjnFK9zJgqKypZOyj8hExy2pY,"Kalau update tolong dong merata contoh fitur musik pada unggahan cerita, ada yang sudah ada dan masih banyak yang belum",4,0,2.25.6.74,2025-03-16 10:07:04,,,2.25.6.74
71c0511f-2eed-4fe3-9484-b9903001ac47,Eka Suciati,https://play-lh.googleusercontent.com/a-/ALV-UjVm9Ai6JDfbr92HbbPW2XoP3IkoStprYsx3yvZowZq7ebdWt-YP,"kenapa update fitur WA di HP satu dengan yg lainnya bisa ngga serempak gitu ya. di HP 1 sudah update muncul fitur baru, tp di HP lain yg sudah di update, fitur masih belum muncul",4,0,2.25.6.74,2025-03-16 05:23:24,,,2.25.6.74
0cc93d9c-3701-47d5-b928-533086610715,Nurul Lismiati,https://play-lh.googleusercontent.com/a/ACg8ocIWTO8k45hbzdJP-d6tjQB5glqbkuT-sx9whISQajgV_pZBXA=mo,WA ku kok gk ada fitur musik ny pada saat bikin status wa..pdhl sdh terupdate kmarin Tolong lengkapi jga aplikasi wa ku Sdh aku upgred kok blum muncul musik di st wa,3,0,2.25.6.74,2025-03-15 04:49:43,,,2.25.6.74
b355a550-9fe2-4b11-ab3e-ffc3312e9c69,Nabila Zahra,https://play-lh.googleusercontent.com/a/ACg8ocJUB8CuKbfbK_11vxwFrXBZtbNz0ttmIkDbZdU6yFOV0ioviQ=mo,"aplikasi ini sangat baguss, tapi tolong di benar kan yang bug bugnya dan ngelag² nya di benerin dlu,, dan wa saya sangat ketinggalan berita",4,0,2.25.6.74,2025-03-14 21:52:07,,,2.25.6.74
412edc17-97f0-4679-88d1-95dfcf0f21bb,Fitri Yani,https://play-lh.googleusercontent.com/a/ACg8ocLb1Uq6OGgzYJ-NyXFZFOOkkAfYBSf181FCT4D1oTEtcZJXOQ=mo,"Update wa bisa pake lagu, apaa hanya di hp tertentu sajaa kaaa?, sayaa sudah update 2 kali tidak adaa fitur lagu, tapi di hp lain adaaa bagaimana? Atau hanya hp keluaran baru sajaaa Yaang bisa adaa lagu nyaaa",5,1,2.25.6.74,2025-03-14 09:18:02,,,2.25.6.74
b64ce318-a56b-45ba-970a-4fe666381577,Warto 1969,https://play-lh.googleusercontent.com/a/ACg8ocJPWx_UMp7Bf3yCjwSGOZANCkyWM___1-g3kpEUoISXyP6x-A=mo,"WhatsApp punyaku ketinggalan update-an muluu, padahal temen² udah ada fitur baru tp punyaku gak adaa, udah di update tp gak muncul² fitur barunya huaaaaa gak tau emg bawaan hpnya atau apalah😭😭",5,1,2.25.6.74,2025-03-14 04:51:07,,,2.25.6.74
f42d6a64-db03-4674-b8c5-4b7a76dc49bc,Deshinta Rinjani,https://play-lh.googleusercontent.com/a/ACg8ocJpESUjnp1-onKrp2t0fLpGf0PvlQOqGoDeJiVACS-ijt2hng=mo,"Bagus banget, tapi sayangnya update aku lambat. Sedangkan whatsapp punya teman/keluarga saya sudah update. Pas saya mau update whatsapp saya di play store malahan ga bisa, ga ada tulisan ""update"" Adanya ""buka""",4,0,2.25.6.74,2025-03-15 05:45:00,,,2.25.6.74
e66f47be-5b1c-4990-a96b-98a419a2c114,Muhammad Usamah,https://play-lh.googleusercontent.com/a-/ALV-UjUguIaV8BxfqpazNv0AaMGQRb2eQn1HHP8inllggWLInepsxDcU,"Please min, fitur musik sebenarnya bagus banget, tapi kebetulan WhatsApp saya gunakan dua akun, harapan saya fitur musik ini bisa digunakan di dua akun WhatsApp, Terimakasih.",5,0,2.25.6.74,2025-03-14 06:56:17,,,2.25.6.74
c7a4c187-98c2-402e-ae48-bc041838353a,Dian Lestari,https://play-lh.googleusercontent.com/a/ACg8ocLnsKp7JL-LXVt1q2zy_MGDPgOJQ4IxC4bc5JuDCzdKlfI8Gg=mo,"kenapa harus di update kn aku jadi gk bisa buka wa lagi karna gk bisa di update,hp ku emang kecil oppo kn hp ku jadi gk bisa di bukak lagi wa nya padahal mau intip² grup sekolah jadi gak bisa klo kayak gini aku mau gimana buka wa nya intip² grup besok ada pelajaran apa klo ada tugas,aku mau tanya ke siapa cobaaa 😔😔",2,2,2.25.6.74,2025-03-13 05:16:24,,,2.25.6.74
de85f046-9796-44b5-9ee6-f4b22d237429,M.Y.A Channel,https://play-lh.googleusercontent.com/a-/ALV-UjUzyxu1Kvy9WjxAkdUS8SCFWD6iI2-rnZNt5Q9PGuMoMvE6n3ea,padahal versi whatsapp udah tertinggi update terus tapi kenapa ya fitur nya nggak ada. Ada yang sama kah dan cara menampilkan fiturnya gimana,4,0,2.25.6.74,2025-03-16 02:03:04,,,2.25.6.74
c0318d4f-d433-48a1-a926-44f041bad2bb,Riska Amelia,https://play-lh.googleusercontent.com/a/ACg8ocIpJkwpVUJP_cyzbMoLXkylFriNWdW6XVA71Lq0U2EpAcS0=mo,"Stiker yang ke send jadi lebih besar, dan kurang nyaman untuk di lihat... Banyak fitur yang awalnya nyaman, tapi setelah di update kenapa malah jadi gak nyaman???",1,9,2.25.6.74,2025-03-14 03:42:02,,,2.25.6.74
1e93d440-ad2d-4b7f-ac0a-2a7ffa0886d4,Alinda Alinda,https://play-lh.googleusercontent.com/a/ACg8ocLeu91EoFLoT58uPa6WEsqHoNp0EaSydgXLmPIoWmqPpYyWTg=mo,fiturnyaa baguss bangett cocok buat aplikasi wajib sehari hari notif nya sesuai tapi kalo udah pesan seminggu nan lebih tlng dong bisa dihapus untk semua orang tapi satu kalo ada yang baru selalu ĺama munculnya tpi overall masih kukasih bintang 5 koo soallnyaa baguss bangett gaa macett amann terkendali,5,0,2.25.6.74,2025-03-16 03:33:13,,,2.25.6.74
9a819dd3-5ec2-439d-96a4-7d597ae99f62,Koloay Andreta,https://play-lh.googleusercontent.com/a/ACg8ocKS115sUMch_l7-0tQ2zopfnZJZLhoapJAt97ArTSMC0pM7sQ=mo,Sudah diupdate tapi fitur musik pada akun whatsApp saya belum ada.. Mohon diupdate kembali🙏 Saya kasih bintang 1 yah nanti kalau sudah bisa pakai musik saya kasih bintang 5.,1,0,2.25.6.74,2025-03-16 12:29:42,,,2.25.6.74
c991eb8c-0f34-4526-b38e-b4440332dfc4,Karina Meylani,https://play-lh.googleusercontent.com/a/ACg8ocJ1RmegrGIJeWkIBZNN1hbvcRxXQh5cWkQJ5H1__ajyMwnkeg=mo,"Wa kenapa ya sekarang sering banget jamkot, sampe berjam-jam, kan jadi terganggu untuk beraktivitas, apalagi telekomunikasi nya lewat apk WA kayak gini. tolong di lancarkan servee",1,0,2.25.6.74,2025-03-16 04:02:08,,,2.25.6.74
e1727a2d-c0b9-46e7-b339-0f5cec5a8507,Dewi Dewi,https://play-lh.googleusercontent.com/a/ACg8ocLC0YXLMNAZxMjYOnqHZqimxE4os5BlJOKxkyDTApf3vdUbqA=mo,"Ini udah bagus bgt tapibkenapa filter di panggilan vc dan di kamera Ndak ada ,sama efek musiknya blm muncul tolong di perbaiki dong",5,1,2.25.6.74,2025-03-13 21:18:51,,,2.25.6.74
6761ea5b-507c-41ab-9ca3-18549d577308,Ade Haryati,https://play-lh.googleusercontent.com/a-/ALV-UjWfCQhsSe8S2r1hSzQFWLtsqHVMV_kAInivnM1rlD1XGZFdZuf_,"Whatsapp makin ga jelas udah di update tapi ga ada fitur musiknya, skrg kalo mau update foto pake kamera whatsapp malah jadi burem banget fungsi meta AI juga ga ngerti buat apa?!",1,0,2.25.6.74,2025-03-15 21:10:56,,,2.25.6.74
e3795e77-bbaf-4ec2-b7de-3f91612408fc,Ineu Sintia,https://play-lh.googleusercontent.com/a-/ALV-UjXyu1AjBoetsaHqUCTVOHjhm-mTCTbTlWyK2LOgvsZGbxX2Alro,"aku bakal edit ulasan aku, kalo whatsapp aku udah ada fitur musiknyaaaaaa 😠😠😠 aku fomo pengen update status pake musik tolong udah di update juga belum ada itu fitur musik 😠😠😠",1,0,2.25.6.74,2025-03-14 01:50:24,,,2.25.6.74
4e6fd0b5-e155-41b9-81a3-2326d488acfe,Kapten tunggal,https://play-lh.googleusercontent.com/a-/ALV-UjXcPJiNZEtL-sK0VSdkvPIw-_FnIfRUwbFAEh2zCptB6zvnx9c,"wa sekarang asal vidio call gambarnya burik, patah patah, suara yang di telpon gak jelas, padahal jaringann full , padahal kalau buka aplikasi lain lancar"" aja full speed",1,0,2.25.6.74,2025-03-14 02:42:28,,,2.25.6.74
85390d4f-3a34-40f7-817a-dab24bd65704,nauuuraaa,https://play-lh.googleusercontent.com/a/ACg8ocKf7xPnA9WCXrCQ01GhJphz2we7oSixNN-gkgRgKw9hYJjnb3k=mo,"fiturnya sdh bagus, namun sayangnya kalo orang² udh update saya lama lagi dapat fitur terbarunya, cntohnya org² sebulan yg lalu udh dapet fitur tema chat warna, sedangkan saya sebulan berikutnya baru dapet, pdhl update gapernah telat 😓",4,1,2.25.6.74,2025-03-13 17:12:57,,,2.25.6.74
976041bc-bf5a-4e5b-8f89-23303aea96a2,Gitss permana,https://play-lh.googleusercontent.com/a/ACg8ocLznvR76LTTD3QWTitnt2VF0b59bFS-MAVFf6vnvFoINPyDZg=mo,"klo ada yg terbaru selalu telat, contoh nya music di status, ga menyebar keseluruhan.",1,0,2.25.6.74,2025-03-15 08:19:11,,,2.25.6.74
c0e36eaa-7069-4f61-be35-fbbdfb0d8308,Rizky Haryati,https://play-lh.googleusercontent.com/a-/ALV-UjVdVgdhN9FOWL2PllBwltPbMOmqA4soslNie6TJqkkFwPQR8FPwkQ,"kenapa setiap ada vitur baru, aku gak dapet?? padahal udah di update juga. kaya vitur AI sama vitur terbaru yg bisa nambahin musik di fto... apa gak semua dapet viturnya? tolong diperbaiki lagi.. selebihnya gak ada masalah...",5,0,2.25.6.74,2025-03-15 21:05:52,,,2.25.6.74
2fd3ea03-edb3-44d3-87de-0065fca981d1,Abdus Salim Bahrisyi,https://play-lh.googleusercontent.com/a-/ALV-UjUwGtwQlgFHnKe7TmURqSE-Xq1iPTlh-AcJVbFe2-lUEf4enk4o,Tolong perbaiki foto profil yang tiba-tiba tidak ada di akun sendiri tapi terlihat oleh orang lain Sebelum di perbaiki maka bintang tetap 3 terimakasih..,5,0,2.25.6.74,2025-03-15 08:45:45,,,2.25.6.74
af18dd8f-9c91-4332-b7fa-a4e4bbdd0e8d,Areta Cantiq,https://play-lh.googleusercontent.com/a/ACg8ocIFfBvVY_3_dRRMuxPTZ_xdoxemH6pgTI7I8CvmhqQOtJZ9fA=mo,"ini begimana sii udah di update mulu masa masih ketinggalan aja, orang² udah yang bisa bikin status ditaroin lagu kayak ig , ini mah belom bisa juga . gimana sii ini whatsapp!!!",1,1,2.25.6.74,2025-03-15 07:25:35,,,2.25.6.74
0961f16a-f727-4d58-b2e0-23645bcba180,Tu Gino,https://play-lh.googleusercontent.com/a-/ALV-UjW12mhSvbxzeqrZ4wmwQFyy71NV4xMREpGoWuCUpOsnBlRJRfc,"Sudah pasti aku pilih aplikasi yang sangat bagus dan rapih di Google play store selalu, bila tidak bagus dan rapih, pastikan! ganti yang lebih baik dan bagus. Terima kasih Google untuk yang selalu terbaik. Dan juga WhatsApp messengernya 🙏",5,3,2.25.6.74,2025-03-14 16:44:17,,,2.25.6.74
fbfe8ba1-4e7f-4d8a-b6f2-f5a788ec7548,Selvy Francisca,https://play-lh.googleusercontent.com/a/ACg8ocLgkucopdd_ZFcPF9NE3NCqzWRltgU1fhJZ5IpPUsxMhefFEA=mo,Pengguna Whatsapp aku pengen di WhatsApp aku ada fitur tambahin lagunya cepet-cepet dong naro fitur tambah lagunya Aku pengen upload foto ada lagu-lagu yang bermacam-macam teman-teman aku udah dapat lagu Masa aku belum dapat kamu tega sama aku ingat ya kamu harus nambahin fitur lagu atau tambah lagu di WhatsApp Story aku agar aku bisa upload Story dengan lagu yang enak jangan pelit😡😡😡,1,0,2.25.6.74,2025-03-14 05:32:16,,,2.25.6.74
7a65b52f-0037-47ed-990c-66cb88e933c0,CVSILVA KARYA MANDALA,https://play-lh.googleusercontent.com/a-/ALV-UjUrgIDUTzqXbgg-koEuNX8eU82q19RGLZbFL2nXb8U_D8jgyhnt,"Saya mengikuti game ini tidak ada tujuan lain kecuali butuh danavbantuan untuk bisa mensupport untuk usaha saya yang baru pemula. jujur saya baru menuai kegagalan total dari posisi saya sebagai engineering yang hampir putus asa . Jadi dari kemenangan nanti mau saya pakai buat modal usaha saya di kebun cabe,terimakasih 🙏.",5,0,2.25.6.74,2025-03-15 21:11:04,,,2.25.6.74
ee9b1dda-380c-4cf0-ae9e-4f9bda783899,Santoso Pacitan,https://play-lh.googleusercontent.com/a/ACg8ocJnZfsFfJqUyJk2PbO2hxEr6bZwJ2HYWTg4FxR_iH2pcY1jAA=mo,"Sangat ringan dan mudah di gunakan untuk terhubung ke semua orang, semoga kedepanya bisa mngembangkan fitur fitur terbaru",4,0,2.25.6.74,2025-03-16 13:16:19,,,2.25.6.74
6a8ae4d3-28fb-43ab-9384-7fd967ab1d51,Gear Project Sinjai,https://play-lh.googleusercontent.com/a-/ALV-UjXPpQx5ZTLn9oQkVzXHMVGOuJ0nSpKcgT_ZePN74h6woeqAFW8_,"Tahun 2025 story WA nya masih burik dan burem? Hahaha. Itu karena kalian malas baca dan malas cari tahu. Coba deh , kalian ke pengaturan. Cari aja di bagian status. Ntar ada pengaturan biar story kalian itu full HD seperti aslinya ( makan banyak cache dan kuota ). Kalau liat story orang lain burem, itu wajar . Karena mereka sama kayak lu itu🤣",5,0,2.25.6.74,2025-03-15 19:16:00,,,2.25.6.74
f6221c38-632a-4055-a732-e3b42a1fa26a,Noer Isfiatin Maulida,https://play-lh.googleusercontent.com/a-/ALV-UjUvPpfmwjHZ6TGaiO0MrOWS7yGB1TVbeBFabJDGDTYRKsgYvew4,"males bgt, yang lain udah pada bisa pake lagu, wa ku belum, padahal updatenya udah otomatis, tapi gasemua org bisa pake lagu, lamaa bgt lagi nunggunya",3,0,2.25.6.74,2025-03-14 16:30:51,,,2.25.6.74
c6ebf6b7-516a-46cc-87fe-fe291ac97761,Meri Andriani,https://play-lh.googleusercontent.com/a/ACg8ocI99JrNiPVYgcXb7ohYEqUfz7FqV75s4ccgx8GF1r-LK3UtUFzL=mo,"Akhir2 ini wa saya sering ke blokir karna spam, padahal saya menggunakannya sesuai ketentuan wa. Hanya saja ada beberapa orang di kontak saya sering spam story karna punya usaha. Jikalau pihak wa ngeblokir seharusnya orang yg spam story bukannya orang yg hanya melihat spam story orang jualan. Karna org berjualan tsb menggunakan wa bukan pada tempatnya. Padahal ada aplikasi wa khusus untuk berjualan.",2,0,2.25.6.74,2025-03-16 10:38:13,,,2.25.6.74
16b333e0-c117-4109-8f39-e1a6fa936f8d,Teza Sukardi yantono,https://play-lh.googleusercontent.com/a-/ALV-UjU3kQJHahj98KFcmmP7LIeZI7VCgRMd0hU0gMntDg7nEHRqIyms,whatsapp orang lain ada fitur terbarunya filter. nambah musik. buble text. di whatsapp saya ini kenapa gak ada ya padahal di playstore udah gak disuruh upgrade lagi,2,0,2.25.6.74,2025-03-15 13:15:01,,,2.25.6.74
9969b8cc-74e1-428c-91b0-62da814c973d,Clara Viola,https://play-lh.googleusercontent.com/a/ACg8ocIGzGkowD_MmdyGuKz902cIK84e5WKlSo0rkT-lWpXZdD1LGg=mo,"Kalau setiap update pasti wa punya ku lama, kadang juga kalau ada yang baru kaya fitur lagu di wa ku belum mohon di perbaiki lagi yah!",3,0,2.25.6.74,2025-03-15 06:51:19,,,2.25.6.74
0c5c68f5-a828-4c9d-a3b9-8a6c61f9100e,Koerul Anam,https://play-lh.googleusercontent.com/a-/ALV-UjWwzrc77uz1X-y73sgPYKKy3oHsTuPTMdey7w7itsEu1_hPzQ27,"Jadi gini ya, in my opinion. WhatsApp kan sekarang ada fitur nambahin musik, nah kok aku belum ada fiturnya ya padahal udah di update tapi tetap aja g ada, sekian saja opini ku maaf hanya bisa kasih 4 bintang",4,0,2.25.6.74,2025-03-15 07:49:16,,,2.25.6.74
40d38c20-0a0e-4638-93ba-6449ec979e2d,Ayu Simanjuntax,https://play-lh.googleusercontent.com/a/ACg8ocLLfUNTwNjKXGVrYV_EPbnMis-ZewMeTO08oGobfyY2WpZGOQ=mo,"kak,aku mau nanya kenapa wa orang orag bisa ngw tag/@? sedangkan wa saya tidak bisa? padahal saya dh update loh,tapi masih aja nga bisa,dan yap tambah lagi nga bisa masang lagu di wa,padahal dh update? kenapa sih hal sekecil ini wa ku nga bisa?",2,0,2.25.6.74,2025-03-15 14:42:11,,,2.25.6.74
e65d69cd-722c-413d-bb07-0c159d3581ff,klaudia,https://play-lh.googleusercontent.com/a-/ALV-UjVZJ92-jXYjy74_4OCNNItzsjX6PKL1_E5qiYO1WF_fqvrXeKU,whatsapp nya memang bagus Semakin.hari semakin canggih.bIsa tandai org di status bisa ubah tema chat bahkan ada lagu di saat muat status tapi syang setelah di update lagunya TDK muncul*,3,1,2.25.6.74,2025-03-15 15:03:13,,,2.25.6.74
56fd83e6-4cea-4e9a-a9df-85b31eeea8b5,Mamad Arobi,https://play-lh.googleusercontent.com/a/ACg8ocLBW8rGG-qwFQ2Z_XuT_gfXPHwjqQbwnMTnRtRF6GQ6UnYX9g=mo,Tolong fitur barunya..Krn udah di update masih gk ada yg baru.. status pakek audio gk ada..Krn di hp lainnya WhatsApp ada...cm punya saya gk ada...mohon,3,2,2.25.6.74,2025-03-12 20:34:12,,,2.25.6.74
986af04d-6498-49e7-ad50-eb5a87e73e4a,Maha Dewi,https://play-lh.googleusercontent.com/a/ACg8ocLzd0qHeRgOpF7xBA5x5RBiF-kyDvQ6KQhEc9BkWYXvC6eAZA=mo,"min update an WA ada lagu nya kapan min, kok belum muncul dihp gua, udah bagus semua, cuma tinggal lagu aja min",5,1,2.25.6.74,2025-03-15 17:43:51,,,2.25.6.74
ff474309-eef4-4dff-aef2-405e867298b9,NanabininyaGiyu,https://play-lh.googleusercontent.com/a-/ALV-UjX6oFM9h6b8hPn-xcO1DcaDGXWPiSu6B0_re9UfznnwjoOKlCmQKA,"Kenapa yaa, kalau ada fitur update baru tuh selalu ketinggalan, apa karena aku pake android 11 ya? , pliss lah WA aku nunggu fitur musik nya tuh ampe 1 mingguan loh😔",3,0,2.25.6.74,2025-03-14 14:12:23,,,2.25.6.74
2769ca60-5a83-4e2c-900c-de85d991d102,Nori Lestari,https://play-lh.googleusercontent.com/a-/ALV-UjUVzKH7y1zjoqQfjW1hFEslfsDylA5kolODm1M7Migsa2S6YNk,Baik cuma punya saya tidak muncul efek saat video cal dan jugak saat video call terus tekan tombol kembali video saya terjeda,3,1,2.25.6.74,2025-03-15 12:33:23,,,2.25.6.74
778b62a5-47ab-43a7-933c-93c32dc8e055,Sarina Rina,https://play-lh.googleusercontent.com/a/ACg8ocJgJcda5kZaUK4svLrHAGz2LABug8ksdpm2Jdq-Z5QqOnvaDTI=mo,"tolong lah wa Janggan pilih""kalo mau ngasih fitur baru😭😭 iri saya Ama orang"" yg wa nya udah bisa bikin musik tapi punya saya .asih belum bisa padahal udah update""😖 tolong lah ni min #whatsaap",3,0,2.25.6.74,2025-03-15 14:42:39,,,2.25.6.74
02c7cf55-9707-47ec-acc0-6f981eccd2bf,ayano Runsenseii,https://play-lh.googleusercontent.com/a-/ALV-UjV-jCKM-s5EZ1BuFU8777_P8C8pwNubaHSZFQhxNB-eJ4n95H73,"bagus, bisa putar lagu di story, dan juga chat nya bisa di ubah warnaa kesukaan, baguss bangett, makasih minn🤍",5,0,2.25.6.74,2025-03-15 10:33:16,,,2.25.6.74
93dcd246-4444-472d-af27-18f4fa92b996,andi muhanip,https://play-lh.googleusercontent.com/a-/ALV-UjUITsWSV3Azft_ryV-EfC4cZ10-ty-XAzasjLR0yd2g3ZVzHma2,"Udah 2025 post story masih aja ga jernih, padahal sama Instagram 1 owner. Tapi kenapa kalo di Instagram kualitas nya bagus banget. Tolong dong di tingkatkan lagi kualitasnya",5,4,2.25.6.74,2025-03-16 05:38:20,,,2.25.6.74
ba74534e-4918-4b56-a700-10ca303d3183,Memey Camay,https://play-lh.googleusercontent.com/a-/ALV-UjX0Xy6uq-R_YvRi_MSf3N0fnJU9fzd9cgJEG4rhHVy0VFIakSqV,"Kenapa ya buat status ga bisa nambahin fitur music, fitur musicnya ga ada Sedangkan dihp saya yg lain udah ada tambahan fitur musicnya",3,0,2.25.6.74,2025-03-14 04:54:38,,,2.25.6.74
3d2e28c2-fb6b-4ef1-8fce-73d96d30647f,Asyiva KH,https://play-lh.googleusercontent.com/a/ACg8ocJusbQWmpVGgMH4RbbqvM3IluWWGMSfw8Icspkk7vEXRaUS=mo,"sory nih ya min, knapa ya kalau main nambah gc ke komunitas itu malah akunnya jdi ""akun ini tidak bisa memakai whatsapp lagi karena spam"" mksdnya knapa ya min??? pdhl biasa biasany oke¹ aja ga kaya gtu? dan saya juga ga ikutan kya freelance kya gtu",1,1,2.25.6.74,2025-03-17 10:24:58,,,2.25.6.74
ce6929aa-0855-4421-ad33-76849faf237b,ika Hasanah,https://play-lh.googleusercontent.com/a/ACg8ocIyLkIfNrKH0Y8aSVMNbgma98Z3J7HG5fxFVk1wnIjvPDca0g=mo,"kenapa WhatsApp ku blm ada fitur musik nya ya? sedangkan yg lain udaa semua, tolong diperbarui cepatt. setiap ada update terbaru selalu lambat punyakuu",4,0,2.25.6.74,2025-03-16 05:38:42,,,2.25.6.74
07710a62-04c2-4d8b-b4b9-aa4d68b1610a,Nina Anggraini,https://play-lh.googleusercontent.com/a-/ALV-UjX7pIG8Eu_rczvSiw-YB_4hog8g9xm3s-tYqMk2dNix7duHkgg,Suka sihh WA sudah sangat upgrade bgt fitur² nya udah makin canggih tp kenapa fitur music nya tiba² ilang padahal kemaren² sudah sempet ada,4,0,2.25.6.74,2025-03-15 06:33:00,,,2.25.6.74
5de9ec9c-e42e-4cc8-9523-07a1e4e8cce8,Muh Tri Sendi,https://play-lh.googleusercontent.com/a-/ALV-UjXe1ZGzDDILoY4c-tac20HOjyZNR5yqjvi6jLoLssbZotUsb02h,"Gak ush ada update2 status di musikin , perbaikin dulu tiap mau update resolusi video ancur terus, telegram, instagran aja bisa mempertahankan resolusi video noh",1,0,2.25.6.74,2025-03-14 13:00:46,,,2.25.6.74
f8640c76-9d60-47b7-aa8b-ad9b00e54e53,Mutia Adi Latif,https://play-lh.googleusercontent.com/a-/ALV-UjVZ-oKRTZTNblJPePxgdrD4STD8oyOVwmhcxTcuhapy6aMCphTMxQ,Setalah update ber kali' hanya mau aktifkan al meta malah jadi lemot mau kirim gambar pun gambar nya jadi warna hitam kalau video aman' aja foto aja kalau kirim jadi hitam semua tolong perbaiki🙏🏻,2,2,2.25.6.74,2025-03-14 12:25:34,,,2.25.6.74
dd69d9f5-336b-462f-a7e6-55ae6e0d0fca,Tia rani,https://play-lh.googleusercontent.com/a/ACg8ocJRuCH1mJtjRX4DrijwhJygqmqr222XIVuPtnFcLOUrtE_G8A=mo,"semakin diperbarui semakin ngga jelas WA, masa ngga bisa kirim stiker sama emot. bukan karna HP gua tapi emang dari apanya masa di chat g bisa kirim emot sama stiker di Sw bisa kan ngga jelas",3,0,2.25.6.74,2025-03-16 01:46:01,,,2.25.6.74
ce820fad-1c12-45e0-ae19-cc3d9f4db60f,Kiki Oktoviantio,https://play-lh.googleusercontent.com/a/ACg8ocLG9mFiDAYmDpxoBWTQplFknRVfHauQXf6SABmHKXy1YfJ_3A=mo,"Saya bingung sama whatsapp versi sekarang... karna no saya sering ke blokir dan udah berapa kali ganti no tetep ke blokir. sampe 3 kali ganti hp, karna percuma daftar whatsapp di hp yang sama tetep ke blokir terus. Dgn alasan ""Spam"" padahal saya tidak melakukan kesalahan apapun... sangat merepotkan. coba tolong di perbarui. jangan sembarangan blokir no orang, karna data data nya sangat penting. apa lagi no nya sudah bertahun-tahun. tolong lahhh",1,1,2.25.6.74,2025-03-14 07:03:07,,,2.25.6.74
46270e12-a0b4-4459-89c1-4decc6909903,Ma'mun Fuadi,https://play-lh.googleusercontent.com/a-/ALV-UjXChhit_bYiDjYeql3mPz-7eUbIeeEEu2lZ7dr95BzhtVZ7XHk,"update WhatsApp selalu ketinggalan jaman fiturnya dibanding WhatsApp orang lain. fitur orang udah ada fitur X, Y, Z, di saya masih fitur A, B, C. tolonglah kalo update menyeluruh gitu, jadi seluruh user dapat update terbaru.",1,0,2.25.6.74,2025-03-14 15:44:18,,,2.25.6.74
