reviewId,userName,userImage,content,score,thumbsUpCount,reviewCreatedVersion,at,replyContent,repliedAt,appVersion
4c81bfae-4368-4afb-a42b-0df050ce00f1,Mil Jml,https://play-lh.googleusercontent.com/a/ACg8ocJmPHmw6Nu9sWEyvNEP66OiWSGlH1uIUHQksoGg5h9_QEpTfA=mo,"Alat bantu yg simlpe gak pake ribet, tapi sekarang sedikit aneh fitur nya, mending untuk online jangan ada yang tidak terlihat supaya kita trs mengetahui saat update waktunya online atau tidak kaya dulu lagi ajja lebih aseek bisa tau tanpa hrs sembunyiin terakhir online Gak bisa buat sw pakai musik",5,1,2.25.6.74,2025-03-15 04:39:10,,,2.25.6.74
a1f71a7a-ae6e-4ff7-a5ec-dcd476a58d32,Lusi Lusiana,https://play-lh.googleusercontent.com/a/ACg8ocLrioG40XyaCf-axlVt6bd8oJ1No9NDgEaXRlnNobGMbMl3iQ=mo,Ko udah di upgrade ttp aja ga ada yg ada musiknya tolong di perbaiki dong udah dua kli ugreg tapi blom juga muncul untuk status yg ada musiknya,2,0,2.25.6.74,2025-03-15 16:15:02,,,2.25.6.74
2955b9f2-9056-4bb7-aa4a-e1d6b45b8cb8,Mami Baper Zehat,https://play-lh.googleusercontent.com/a/ACg8ocLtwX6K9O8So_xr_8jOByO-cBmypSzGBWsm0gNz0k1dwEq-XQ=mo,Sangat buruk saat video call suara saya menggema dan tidak jelas didengar oleh orang lain padahal mikrofon saya tidak mengalami sebuah masalah Sama seperti 1 tahun yang lalu kenapa suaranya itu berdengung dan suara saya itu menjadi seperti robot apa yang terjadi pada aplikasi ini Apakah sedang mengalami error yang luar biasa di tempat asalnya di sana ?!!!!!!!,1,181,2.25.1.75,2025-01-30 11:22:38,,,2.25.1.75
90444cba-35e5-4182-a166-ded2eb1c25d4,Adhima,https://play-lh.googleusercontent.com/a-/ALV-UjWyE40pdBInuz24M8iSmWBHDzwia8u-B71_OsZQ8Qc6qxc_w3aO,"tolong dong upgrade lagi buat saluran nya biar bisa pin pesan dan mengirimkan musik/lagu, terus untuk tampilan status nya di buat seperti dulu saja, lebih enak dilihat🙏🏻🙏🏻",5,1,2.25.6.74,2025-03-14 11:47:27,,,2.25.6.74
206c6c4e-a5d0-4588-8e39-cbeb772b79b6,Revalia Meisyah Azzarah,https://play-lh.googleusercontent.com/a/ACg8ocJA6G_RrIVsB194m0Q_15kfCQpJk5PnEamhKYQZecMFsB4SEQ=mo,"Saya sudah update tpi kenapa belum ada fitur lagu nya, wallpaper warna pink nya juga blm ada pdhl di tmn saya sudah ada pdhl hp nya sama, pdhl ngeupdate nya cmn lama 3 hari aja tpi stlh itu di update ttp tidak ada muncul fitur"" nya Minta tolong ya WhatsApp sesegara mungkin perbaiki TERIMAKASIH:)",2,0,2.25.5.74,2025-03-12 10:51:43,,,2.25.5.74
d510fbf8-f262-498f-98d7-fefa21d91d26,RVED Channel,https://play-lh.googleusercontent.com/a-/ALV-UjVbUFUA4wCHJ_YyYXebvMmzHeGfLTpIim8zAIVrT_K2REGNgSALJw,"Enak wa sebelum ini,story berdasarkan waktu update,sekarang enggak. Lalu kalo mau kirim foto dulu bisa pilih dari folder lainnya, skrg gk semua muncul... Payah..",2,14,2.25.4.77,2025-03-09 09:09:29,,,2.25.4.77
5484e6dd-97e9-4c4f-b642-ebdc3efd123d,Aulia Arifani,https://play-lh.googleusercontent.com/a/ACg8ocIKm8hab2GhfGD5Mxuf5GOqaTwDW6YYw0Z5WzXNEQfk-oLxRsk=mo,"Fitur aplikasi wa sekarang audah semakin canggih. Saya juga berharap fitur wa menyediakan jam berapa pesan kita di lihat penerima pesan. Karena saat kita penting, seseorang yang tidak mengaktifkan pesan telah di baca, kita jadi gk tau mereka aktif atau tidak. Masalah tagih hutang misal ny",5,9138,2.25.1.75,2025-02-03 08:26:36,,,2.25.1.75
18a64f74-1776-4c91-bfd7-17f1b3e9e282,Nabila Salsabila,https://play-lh.googleusercontent.com/a-/ALV-UjX3-poCnTsljQFcG3S6X_N2TtrsL2ms8XphE6KDBRb07nnfRujc,"kualitas video saat up status jadi burem, katanya ada fitur baru, fitur musik di WhatsApp, tapi ini udah update 2 kali kok belum muncul juga fitur nya, padahal yang lain sudah ada",2,0,2.25.6.74,2025-03-15 23:04:15,,,2.25.6.74
ad64a664-0bd3-482b-a68e-875672f92f73,Pratiwi Ivana,https://play-lh.googleusercontent.com/a/ACg8ocKTy1m7HOY11ziRZZM7PSAu1veD0izgAXg4gbuobWHMJ43EiA=mo,"ga muncul fitur musik di story nya padahal udah update gatau mau nya WhatsApp ini apa katanya juga belum di resmikan tapi kalo belum di resmikan gausah temen"" gua lu adain dulu ga adil ini namanya padahal hp gua ga jadul"" amat cepet nge update udah versi terbaru lo tetep gabisa udah restart lagi lama"" gua gila ni gara gara fitur gblg ini",1,4,2.25.6.74,2025-03-13 16:46:45,,,2.25.6.74
2c3c311a-0394-48ed-a47d-81bf0185b717,Nukke Utami,https://play-lh.googleusercontent.com/a/ACg8ocL7GC3E-QKeqEOiYk91e9p5YJOwAoF8u6j9gsx8XMnWiucKxQ=mo,"Akhir akhir ini sistem WhatsApp saya selalu di blokir dan kena spam Padahal tidak melakukan pelanggaran ketentuan WhatsApp. Saya bener bener jengkel, karna WhatsApp sangat penting dalam berkomunikasi. Tolong pulih kan akun WhatsApp saya dan selesaikan masalah ini.",1,1,2.25.6.74,2025-03-14 05:12:02,,,2.25.6.74
4bb02c0a-d5f9-4764-9cae-7970918990de,Fenny Diyah,https://play-lh.googleusercontent.com/a-/ALV-UjXB3O_iT_ap53_Us2Pz_8YnETy1jVjQdwMUJCb9R_Ii6tYHr7Ht,Perangkat saya tidak bisa updet dengan cepat fitur2 terbarunya whatsapp seeprti mention dan tambahan music yang sekarang sedang booming. Terimakasih,1,0,2.25.5.74,2025-03-12 11:07:02,,,2.25.5.74
f7053f17-33dd-486a-bc04-1296ea161329,Kayla lolok,https://play-lh.googleusercontent.com/a/ACg8ocJ9cpPmGM87fSJ2UuW7KeJwlSuunIMl6YtT55ZCohRC6eVNmw=mo,"sudah bagus teknologinya, cuman kalo ada fitur-fitur baru saya terlambat dapat fitur-fitur itu misalnya fitur lagu seperti begitu, tetapi whatsapp tetap bagus dan keren kokk😁🔥",5,1,2.25.5.74,2025-03-11 13:48:29,,,2.25.5.74
effdb373-565f-40f0-ae9d-34d81317f0ce,virgin Putri,https://play-lh.googleusercontent.com/a-/ALV-UjXbA6fQQnJ1W2SKIzwcFuUvgSwDs08xfRj_HVB7PUXu4_XPGJXu,"sebenernya udah oke, cuma kalo buat story wa tu gambar/video nya jadi blur, dan kalo update lama tp yaa semoga kedepannya jadi lebih bagus dan ga blur² lagi ❗❗",3,0,2.25.5.74,2025-03-16 07:05:38,,,2.25.5.74
ac9c32c1-d7b7-417e-8b05-ac429de85086,Yoga Dani,https://play-lh.googleusercontent.com/a/ACg8ocIHvnFhpqwaQ8nFXMNzmK5AvCEK3Ava_gy7sqQQ4qVp5f0Qkg=mo,"sumpahhh,kenapa klo masih telponan tiba tiba menghubungkan ulang terus mati sendiri,padahal sinyal juga bagus bagus aja,dan pas di telpon balik otomatis panggilan ditolak,,ada yg sama kaya gini?gajelas bangettt!",1,18,2.25.3.82,2025-02-24 02:45:47,,,2.25.3.82
df0b7ca2-3177-49c7-b376-1d250565537b,Qurratul Aini,https://play-lh.googleusercontent.com/a/ACg8ocL-y4PNnncaSxmAD4Vp6fxOIYYoUgiotCumky4S6pQu6HzTZA=mo,"Kenapa yg awalnya bisa bikin story pakai musik sekarang udah ga bisa padahal udh update padahal kalo ada musiknya keren,pliss bikin WhatsApp yg kalo bikin story' ada musiknya",4,0,2.25.5.74,2025-03-11 12:55:17,,,2.25.5.74
d2098835-de3a-4ec3-a5c4-261474b49e79,Mandayourfavgirl,https://play-lh.googleusercontent.com/a-/ALV-UjXIzKTcQGYp4mSM7UpRIaMUi0neuIvZ0D74IO46MisnF90GFi4,"Menurutku wa udah bagus banget tapi kenapa di sebagian handphone ada yang tidak bisa memakai filter saat video call dan kenapa tidak muncul bubble chat , jadi kyk terkesan pilih kasih gitu .",4,0,2.25.2.85,2025-03-11 04:48:41,,,2.25.2.85
280cc845-721c-484a-a306-5054def305bd,ellen leatemea,https://play-lh.googleusercontent.com/a/ACg8ocKa0p8cbROUMliWukacmTp44xbB25Fc0cTNTwtIz_WnqMmEmw=mo,"yaaaa ini oke si, bagus banget buat komunikasi jarak dekat/jauhh, i like it !!! butttttt !!!!!!! kalo mau update jangan dikit dikit, kadang kasian sama orng yg ram hp nya kecil,harus update gituu.... samaa kalo ada orng yg ga bisa updatee(ram terbatas) jangan kasi tanda ""whatsapp kadaluwarsa"" atauu apala itu,kasiann taukk,yaa udah laa itu ajaa kalo luapin semua, capee, intinyaa udah baguss !!!",4,23,2.25.4.75,2025-03-03 10:12:41,,,2.25.4.75
1c8e62ae-a5ad-459d-9b5f-233ea2e2b01a,harry gunawan,https://play-lh.googleusercontent.com/a-/ALV-UjWk5eEQq7Tj0_F0mM_d7hLEFrRItB7EKGwvrOgPxHPrEOBP0V35,"Halo pihak tim dukungan whatsapp, sbg salah satu apk yg paling populer sebagai media menyampaikan sebuah pesan dan panggilan, dlm mempermudahkan segala informasi yg ingin disampaikan terkendala salah satu fitur wa yg menyebabkan terspam wa dan terkeluar dari apk wa, whatsapp tidak dapat dibuka, ini sangat merugikan apa lagi whatsapp digunakan sebagai media utama dalam dunia penyampain perkerjaan. Mohon di tinjaun ulang para tim pedukung whatsapp yg terhormat, semoga tulisan saya ini dibaca",1,41,2.25.3.82,2025-02-21 01:04:07,,,2.25.3.82
57d6f766-b25a-4a3a-9505-caf3b6a80e65,Nurul Novita Rahman,https://play-lh.googleusercontent.com/a/ACg8ocK-4BdEg-Vlji0bMHxFlNbrmI9fQc-ePK7ujkZA9lBwoHoudA=mo,"kenapa update status whatsapp saya tidak bisa pakai lagu, padahal sudah di apdate dan pengaturan sudah diizin kan semua. sampe uninstall tetep sama, yg ada data chat semua kehapus. payah",1,0,2.25.6.74,2025-03-16 02:21:07,,,2.25.6.74
ef4e1cad-b815-4ab8-ad15-ea26ff28cbe1,Sultan Satahi,https://play-lh.googleusercontent.com/a/ACg8ocK-wW1vXkfRfFS7cpE-qGxzMDAOD1X2ZqanVyVLAm5-H4YXeg=mo,"Ini npa yah!! Asal ak mau menghapus status loading penghapusan nya lama bgt!!! Tulisannya hanya menghapus......!! Tetapi ga ke hapus""!! Tolong di perbaiki lagi yah bug nyaa, makin lama makin parah aja!! Ak udh sampe 2 kali ganti nomor tapi hasilnya bug trus yg ad!! G pernah tenang klau pake di apk!! Mohon di perbaiki lagi yahh!!!",1,22,2.25.3.82,2025-03-03 13:54:30,,,2.25.3.82
c72c91df-708e-4de5-9a1b-b8b64d4a3db5,Diazarid123 Febrianputradiaz,https://play-lh.googleusercontent.com/a-/ALV-UjXudTZVBfKFqD__ybPUt_oKjv6J1Q3LbclT1lNkHqoc48XxkGM,"ada sedikit bug, terdapat pada saluran, nah di situ seseorang ngirim vidio, tapi kok gak ada gambar"" nye gitu, cuma abu"" aja, dan hitu gak cuma di 1 saluran tapi banyak, padahal udah sepenuhnya gw download vid nya, mohon untuk di perbaiki lagi ga developer",5,11,2.25.5.74,2025-03-07 05:24:52,,,2.25.5.74
9984bb72-947a-49d6-b578-d1e45af4dd81,Rifa Lestari,https://play-lh.googleusercontent.com/a/ACg8ocKE9eaC3UwAABrye1FWu86PVjzXg2pHINA8w6r7uNAcV3lx4A=mo,saya mohon agar tidak ada nomer yang tiba tiba bug wa sehingga tidak bisa buka wa sering kali kembali teruss tolong hilang kan sayang tidak nyaman jika begitu apalagi jika tiba tiba nomer yg kita pakai hangus!! padahal tidak ngapa ngapain tolong di larang!!,2,14,2.25.4.77,2025-03-04 17:09:37,,,2.25.4.77
da77d04a-ab77-446c-b92e-6f75c266ec9e,allffyyyaaa_,https://play-lh.googleusercontent.com/a-/ALV-UjW-l3dk5N7FdSsGyUR9pCvxyvDr5ysXsMJoAavBBt6hGoGGvqLozg,"menurut aku, fitur baru yang status global itu termasuk privasi ga si? menurut aku mendingan supaya statusnya ngga burem deh, biar HD gituu, trus mungkin tampilan wa nya ada yang sedikit dirubah supaya kelihatan aesthetic gituu ahahahhaa rorrr",3,0,2.25.5.74,2025-03-10 14:12:50,,,2.25.5.74
65b97ed0-8bed-442d-923a-5af645d64269,FIKRY,https://play-lh.googleusercontent.com/a-/ALV-UjXxD3p83Y-rlxEBWT9jY6aPsVzX0VXALWnne19Ix1w2pwG3doM,"Kenapa sekarang saya menggunakan whatsapp sering pending saat kirim pesan padahal sinyal dan koneksi bagus, buka sosial media lain lancar kenapa saat kirim pesan di whatsapp selalu pending dan pesan lainnya tidak masuk, itu sangat merugikan karena saya banyak tertinggal informasi yang penting tolong di perbaiki developer",1,11,2.25.4.77,2025-03-05 10:08:51,,,2.25.4.77
51b59afd-c67b-420b-b0b4-3f62bc47f908,Erlangga Putra,https://play-lh.googleusercontent.com/a-/ALV-UjVrJgLVq-HikS-fKYGLA10aVmEKLHkFvOPE0eWViKKPuBkiG38Z,"Wa eror gabisa dengan vn dan gada suara sama sekali di status wa. Coba di uninstall dengan mencadangkan semua file dan data, download ulang berharap semua kembali normal malah file dan data yang telah dicadangkan HILANG dan wa tetap tidak ada suara + tidak bisa kirim file dan dokumen sama sekali!",1,166,2.25.2.85,2025-02-11 07:45:34,,,2.25.2.85
5e7c2e20-4b31-402d-b638-eaa497e55c55,Sayyed Abdul,https://play-lh.googleusercontent.com/a/ACg8ocKaZhagFvl2sHrv7qqewRlxmtPnLK55pHQ6HjhlKgRmTy_NGw=mo,WhatsApp ku pasang kunci sidik jari beberapa bulan ku kupake aman² sj tapi akhir² ini kadang error WhatsApp ku gak bisa masuk padahal udah update udah cek penyimpanan masih bnyk tapi pas mask ke aplikasi nya gak bisa cumn ada tulisan buka kunci di tekan gak ada pilihan biasany klw di tekan buka kunci nya langsung ada pilihan sidk jari dan sandi tapi ini gak ada mohon solusinya,2,17,2.25.3.82,2025-02-26 13:28:26,,,2.25.3.82
af87b565-f4e6-401e-a13f-084af4743710,Fauzan Bilal Mahmuda,https://play-lh.googleusercontent.com/a-/ALV-UjVMdtYMYXgvkNIF0UUNpNcOeWs__gtgA-v72kQztimyrVYWE-6SlQ,"Aplikasi wajib setiap hp si ini mah, Oia coba WhatsApp ditambahkan fitur absen yang bisa di rekap semasa masa waktu, karena kan juga sekarang kerja dan pembelajaran sudah menggunakan WhatsApp. terimakasih semoga di respon dengan cepat",5,1,2.25.6.74,2025-03-16 16:46:35,,,2.25.6.74
6c0ec74c-ef81-43c0-bedd-0d8d0d81fab9,19-028 Rizky Wisnu Tri,https://play-lh.googleusercontent.com/a-/ALV-UjXWSN0MCIRyeTb_RkP-Vs_u1eCoz74K_vfdqQE3B4YrPxAhVvTQ,"Panggilan sering gagal, gk tau ini bug atau gimana, tapi tiap nelpon malah panggilan gagal, coba lebih dibenerin lgi, karna sangat mengganggu, kadang panggilan juga gk bisa, malah dikira orang aktifkan mode dnd, padahal gk pernah aktifkan mode dnd",1,193,2.25.1.75,2025-01-29 03:44:41,,,2.25.1.75
0c2f564e-059f-4c73-ae7b-1f1c90bdc779,Giffari Alkahfi,https://play-lh.googleusercontent.com/a-/ALV-UjW7k6kNIDlsGWO_AWbGq23BlA6l0Y0eSTIyumveWJhYaQtmPR0M,Aneh bgt suke nge freeze trus nada deringnya notifikasi nya udah diganti tiba2 berubah lagi ke standart ga bisa di custom lagi Cacad bgt update an nya Plis lah balikin ke versi awal yg lebih mudah dan lebih fleksibel,1,11,2.25.4.77,2025-03-05 15:56:58,,,2.25.4.77
64b9ecbe-52e0-44b5-8345-c99df6db9f2c,Sicca Nurhayati,https://play-lh.googleusercontent.com/a/ACg8ocKKmHnNOteSedr6q6Fe4RYlzSJzZ9zkq5s7d5epbb9MHbaPlUOb=mo,"baguss bangett, cuman fitur baru yang di status wa saya belum ada fitur lagu nya, tolong di percepat adakan ya whatsApp, selebih nya sudah bagus, jadi segitu saja komplainan saya, terimakasih.",5,0,2.25.6.74,2025-03-14 04:29:32,,,2.25.6.74
4c4cf1b7-0bda-486b-9033-2c7717c06cdb,Indah Maulidia Putri,https://play-lh.googleusercontent.com/a-/ALV-UjW6_DegKNU38zTX2DNAdoIZOUUHGyB4S4t6IXmU7AmCLlUucvYJ,"awal update ada fitur filter, sekarang filternya ilangg?? terus update musiknya manaaa.. yang musik masih make sense misal bertahap.. tapi ini apaa??, mana filternya??",1,7,2.25.6.74,2025-03-15 12:08:42,,,2.25.6.74
80c0e210-9d8b-490a-af9e-2537dc276839,tejo sulaksana,https://play-lh.googleusercontent.com/a/ACg8ocJpzInVphkY35AtzbllleieONt1Q8ifCBbntjV0aZJ0FR3SvA=mo,setelah ada notifikasi update...begitu di-update malah bahasa jadi dobel.inggris+Indonesia.....setelah distel pengaturan bahasa pada WhatsApp dan perangkat Hp masih sama saja....lapor ke pusat bantuan suruh tunggu update selanjutnya.begitu di-update notifikasi selanjutnya masih sama saja....tolong yang jelas dong....kan jadi ribet kalau begini,1,21,2.25.4.75,2025-03-03 14:53:08,,,2.25.4.75
86966a79-ef43-410d-ba00-2654a853015b,Galang business,https://play-lh.googleusercontent.com/a-/ALV-UjXdZysESyDoSrAgujnEOklM5asxgUn_DpSnLq2jmjRfC5qpUZI,"aplikasi nya bagus banget, tapi sayang kadang di hp saya fitur terbaru nya wa selalu dapet belakangan. kayak sekarang ada fitur musik di wa, temen² saya sudah dapat sedangkan saya belum",5,1,2.25.5.74,2025-03-12 03:03:50,,,2.25.5.74
9ed28341-1e7c-4144-9de8-9c42cd2d639a,Aldino Nata Suseno,https://play-lh.googleusercontent.com/a/ACg8ocJQ38NAHmsKpR9m0gA_U9Zc_oaa4ZHltL1-YhAp7BfgBresb1_x=mo,"Gabisa restore chat, sebelumnya sudah dilakukan backup. Saat pertama kali masuk whatsapp cuma ada tulisan ""memulihkan media"" Di notifikasi, tapi tidak ada action yang terjadi di dalam aplikasi",1,0,2.25.5.74,2025-03-10 15:51:17,,,2.25.5.74
f65e68bf-44c8-4079-af50-61424939a97f,Pika Pika09,https://play-lh.googleusercontent.com/a/ACg8ocIhXfyFg2qyrp_EVf93sjD0AGYFgd1oAJNl5qonTuFpE2kR9A=mo,"masa enak' chat an tiba' wa gabisa di buka , pas udah bisa di buka malah ada tulisan "" anda perlu memakai whatsapp resmi untuk login "" pas udah d unistal trus dowload lagi malah muncul tulisan begitu lagii padahal itu udah whatsapp resmi dari awal",2,17,2.25.4.77,2025-03-04 05:38:13,,,2.25.4.77
47eaa4c1-2d03-4ce4-a1fa-c9b32027bac5,Habiba Roadissa,https://play-lh.googleusercontent.com/a-/ALV-UjUuidSmUpi_XFn2mS1z5npeaJZpD3KwcEKiUD69eBOs2Ia1ZGkt,"Saya sudah melakukan backup chat ke alamat email, saat di device baru, chat yg sudah saya backup tidah bisa dipulihkan. Saat proses pemulihan di 69% selalu forced close. Mohon diperbaiki!!!!",1,0,2.25.6.74,2025-03-15 14:41:58,,,2.25.6.74
21945cde-5a89-4cf3-9ab9-23ea3bda486c,TOPENG Official,https://play-lh.googleusercontent.com/a-/ALV-UjVlibVnk6FPwMUyXFMc78p2uJ4UDe-CgQ3dX2omLvRzxbLenDg,"Tolong untuk pihak WhatsApp mohon untuk tidak terlalu ketat dalam urusan spam, karena saya setiap ganti SIM card selalu dituduh spam padahal saya tidak melakukan apa apa, dan ini paling bikin saya kesel, setelah akun di pulihkan selalu tidak bisa login dengan alasan anda memerlukan aplikasi WhatsApp resmi untuk login, padahal saya pake apk resmi dari google play dan bukan apk mod",2,0,2.25.6.74,2025-03-15 09:49:47,,,2.25.6.74
b02c302b-6d5b-429e-8929-4ed07e0851f4,Christuvel Manansang,https://play-lh.googleusercontent.com/a-/ALV-UjVZyl5jhLpw_8QKRL8KzOXTvOr9vWZfwfbIa-8K0HG6ROkxEhgG,"Baik sekali Tapi saran saya whatsapp juga pakai sound musik dong untuk statusnya baik foto atau maupun video, seperti facebook dan Instagram🤗🤗🤗 Akhir tecapai juga ad sound musiknya🙏 dan tolong untuk update lagunya lagi spya lebih bnyk lagi lagu2 yg kita inginkan😇",5,3,2.25.5.74,2025-03-13 02:23:47,,,2.25.5.74
139a99f0-f939-435d-836c-aa369c78fbd1,Rendi Setia Anggara,https://play-lh.googleusercontent.com/a-/ALV-UjX9_UDwzv4XuS_2XLfQkxEVug57QvqbGR3RCBmbeB5M4ezZ5DeU,Update Bug terbaru : ada masalah mendownload gambar/video dalam satu tumpukan (lebih dari 4 file) pasti tidak bisa di download namun tidak terjadi stuck pada tampilan hanya saja TIDAK BISA DI DOWNLOAD,1,12,2.25.5.74,2025-03-08 16:28:53,,,2.25.5.74
ad180173-b43f-4140-9da5-74756cd287a5,ARMY BTS,https://play-lh.googleusercontent.com/a-/ALV-UjWYYHogWEWLt1HFlbyxBRH71Mw--V3OnqPYp3OrEzYj-xV19ZlY,"whatsapp sekarang lebih canggih, sudah ada fitur untuk nge tag orang lain, efek, gelembung chat yang bisa berubah warna, bahkan ada fitur lagu di status...bagus banget..jujur puas banget dengan perubahan whatsapp..terus berkembang",5,1,2.25.5.74,2025-03-11 16:03:26,,,2.25.5.74
cd393dfc-a8f7-45f0-adef-fb77d83774c8,jeliskawati j. mau,https://play-lh.googleusercontent.com/a-/ALV-UjXNvz-3GhFeUOMNr0KapMO_Z4k6B6TS2t_s0oCdPmf85wHn4Gk,Kenapa hp samsung A20S fitur meta AI sama ikon music tidak muncul di aplikasi WA saya ? Padahal aplikasi WA baru saya update tapi tetap tidak muncul . Mohon petunjuknya ..,1,0,2.25.6.74,2025-03-15 12:41:01,,,2.25.6.74
71099056-3b98-48b4-94fc-41b9a22b6879,Fera Kristia,https://play-lh.googleusercontent.com/a-/ALV-UjVjG5BzWlqsouh2gMDbIrZ14buKKL27sDK72jPLQq6SmjFwSz9ttA,"Hemmmm selalu saja whatsapp saya ketinggalan zaman, di orang orang udah pada update semua tapi kenapa disaya lama banget, sampai sampai nunggu 4bulanan baru ada vitur""baru padahal di whatsapp orang lain udah ada sejak lama vitur tersebut. Dimohon ya aplikasi whatsapp ini bisa lebih baik lagi.",3,0,2.25.5.74,2025-03-13 15:20:43,,,2.25.5.74
d33b86b2-4d84-4659-8a5d-a818c6d1822c,Athaya Sanli,https://play-lh.googleusercontent.com/a-/ALV-UjUhaNmY3bpKOgFqU7svv846L4i6ArkF29YM8TYE3gmn3uZKgJ8,kenapa ini!?? waktu buka voice note layar tiba tiba gelap dan cuma ada suara nya. waktu panggilan telfon juga layarnya gelap dan saat telfon selesai baru layar kembali ke semula ini kenapa!!!!?? mohon di perbaiki secepatnya karna orang tua saya sering mengirim voice note dan telfon dan saat ada kendala seperti ini saya sangat kesulitan!!!!!,2,0,2.25.5.74,2025-03-10 06:09:33,,,2.25.5.74
40468e59-6ecf-48a8-b9dd-feea4a69a717,15. Hafidz Kurniawan,https://play-lh.googleusercontent.com/a-/ALV-UjU4SMYt8XMVEEGOCzAA-7q0Yt1mZUDxx9ncMR0CbRUyMqbIDXY,"Kenapa dah fitur musik di story saya blm muncul aneh banget, padahal sekitarku dah muncul semua fitur itu, tolong dong, aku dah tanya ke whatsapp ga ada hasilnya juga Tolong munculkan ya😁🙏",3,0,2.25.6.74,2025-03-14 22:38:49,,,2.25.6.74
71e39a6b-7af3-4997-ab81-620817675a5e,Haruka,https://play-lh.googleusercontent.com/a-/ALV-UjVK2CMb1RS8y6p00_CODcrp2j-VDNtg_WB4gYzkeOfUFL31Rjc,"Aplikasi nya bagus, cuma kekurangan nya adalah keamanan nya, akun saya sudah beberapa kali hilang karena kena spam, padahal saya tidak pernah melakukan hal-hal yg mencurigakan atau aneh, saya menggunakan whatsapp seperti biasanya, hanya mengirim pesan biasa dengan teman-teman saya, mohon keamanan nya ditingkatkan, saya sudah berulang kali agar akun saya kembali",2,17,2.25.3.82,2025-02-22 09:26:19,,,2.25.3.82
49a59c68-1d75-4b50-bf75-35ea5afc424a,Kilang The_fox,https://play-lh.googleusercontent.com/a-/ALV-UjVX1jdrX712K9DVWz1eOt637jGAk1r_uncvapIQfPlbWgc7V5w,"""Pulihkan riwayat chat Terjadi kesalahan dengan riwayat chat Anda. Jangan khawatir, Anda bisa memulihkan riwayat chat dari cadangan. Jika tidak memulihkan sekarang, Anda tidak bisa memulihkannya nanti."" Bang.. plis lah, sudah seribu kali kena pesan baj*ng*n kayak gini.. gini deh pak.. coba bayangkan ada yang ngechat bapak malem kemarin, nah pas pagi ini pesannya belum kebaca udah ilang.. kan di kira enggak ada yang ngechat, eh ternyata banyak.. INI GIMANA NYELESAIN NYA!?",2,0,2.25.5.74,2025-03-12 20:35:14,,,2.25.5.74
93d3bb0d-84d9-4655-9eed-c78fc7224e6e,Lycene Kim,https://play-lh.googleusercontent.com/a-/ALV-UjUhHwSpqC1aRRFw4E7F_03USYKKQn-wNJYPiUWI8S7oEoem-ks,"Dear meta bisa gak sih fitur studio AI di hilangin aja? Terlebih responnya aneh dan nyeleneh gitu dan kadang nih kalau lg chat sm META AI yang biasanya responnya jadi kek eror terus berulang ulang. Dan respon dia begini terus: ""Sorry, I can't help you with this request at the moment. Is there anything else I can help you with?"" Dan ini terjadi sejak ada fitur studio AI. Ntah aku doang yang ngalami atau memang ada yang sama dengan ku. (sengaja bintang 5 biar ke notice)",5,1,2.25.3.82,2025-03-16 02:57:50,,,2.25.3.82
2b2d71a9-9b37-413e-b02d-9a0f72480b30,Rena Official,https://play-lh.googleusercontent.com/a/ACg8ocIDpGirVuKMuWxFdSV8CqV5RTzkgeRSvQuUwvH0sUZavbsp1A=mo,"Ini aplikasi yang 99% orang Indonesia pakai untuk berkomunikasi, tapi kenapa ya update nya itu terkadang suka lambat atau cepat dari orang lain?, kyk aku udah dapat fitur A tetapi teman aku belum dapat walaupun udah di update",5,1,2.25.6.74,2025-03-14 04:42:53,,,2.25.6.74
a6df6174-7366-45c8-8ea6-37b9234a37f3,Ibrahim Hidayatullah,https://play-lh.googleusercontent.com/a-/ALV-UjUIQbnf3v0fkXhlF-3gK0qgYPMqu2DjNxFHxO17F14igOKKVpigFg,Permasalahan yang tidak kunjung diperbaiki adalah kualitas foto dan video seharusnya tidak perlu di compress. Paling tidak beri opsi untuk user jika ingin upload dengan kualitas tertinggi tanpa menurunkan kualitas gambar atau video,2,0,2.25.6.74,2025-03-14 12:39:42,,,2.25.6.74
710dcf29-3de0-4731-9bdd-ddbe35ad50f3,Prstyyy,https://play-lh.googleusercontent.com/a-/ALV-UjWjwRs72SWVfdeNvrojBEo3HDCssUYi7VB09M8mwyjQYNYDUqI,"aplikasi sudah bagus tp mohon untuk sedikit perbaikanya,tolong untuk keamanannya di perbaiki lagi,karena banyak korban yang nomornya dihack tanpa memberikan barcode/informasi penting,hacker jaman sekarang pinter', dan juga mohon untuk jika kami melaporkan suatu nomor langsung ditangani agar tidak terus berulah nomor tersebut,mohon perbaikannya ya 🙏 terimakasih!",5,1,2.25.6.74,2025-03-15 18:20:25,,,2.25.6.74
78666653-609c-49e1-8165-d29cca02f65b,geminiii,https://play-lh.googleusercontent.com/a-/ALV-UjV1BT3cK7686Do2dhxNTSZfi3vdr0QY-Vk9JAQbcXmhpf8SyxeC,"sekarang gabisa zoom foto, padahal sebelumnya bisa, padahal juga udh diupdate, gw update sendiri, memori jg masih pas, liat foto sekarang jd kurang jelas soalnya gabisa dizoom😭 klo update tu ya makin maju dong bukannya makin mundur, sekarang malah ada kendala lagi foto gabisa dizoom jd kurang jelas, apalagi yg fotonya kecil😔",3,79,2.25.2.85,2025-02-18 07:52:27,,,2.25.2.85
fabba8f8-6411-4c92-82ac-4a2a64a1f84b,Khairunisa Azzalea,https://play-lh.googleusercontent.com/a-/ALV-UjXwty2-B0Zboa7Y3RvHE64J9EgD6LmPBe3Rpx4mrD02yv_6RJXg,"Sebenarnya bagus sih,cuman ko sekarang di aku ada bug? Tolong hilangkan bug nya,bug nya aneh banget,masa aku baru masuk apk langsung keluar,terus tiba tiba keluar dari nomor aku,tolong bener kan.",3,13,2.25.4.73,2025-03-02 04:27:32,,,2.25.4.73
5f698101-6e7b-4ba8-ab12-c252c532e6ab,Devia Zulvani,https://play-lh.googleusercontent.com/a-/ALV-UjUcuXB5fkY8hyTd3r5pDE2zlVVrmNryyfVtbLbw4KAYDhtM2v-P,"Kenapa update an di saya selalu tertinggal daripada yang lain. Disaat yg lain update ada fitur-fitur baru, WhatsApp saya kok ga? Sering bgt gtu heran ga muncul fitur baru kek yg lain, padahal sering di update, ini delay apa gmna si developer aneh bgt.",3,0,2.25.6.74,2025-03-15 14:49:58,,,2.25.6.74
e9920e26-8062-4269-83df-8ac835fbeda3,yudi agung,https://play-lh.googleusercontent.com/a/ACg8ocJHpESS5tsNKTNa1v96BNUoKzfTiKy54PICr1C2vE49yzwtaQ=mo,Temukan saluran untuk di ikuti. Bener² mengganggu sekali ini .tolong di hilangkan saja kalau bisa. 2. Kalau membuat sw .foto maupun vidio kalau bisa usahakan jangan jadi blur atau pecah gambar nya .buatlah apapun menjadi hd. Terimaksih,1,87,2.25.1.75,2025-02-09 04:32:42,,,2.25.1.75
73eeae0d-182b-49a9-aa7f-4db16c6f6206,AbanK IrfanK,https://play-lh.googleusercontent.com/a-/ALV-UjWMEXble0XQ35V6R4e_qCLmjp_AJellAa5mI3VNCedKrVaToBU,"gimana sih sistem cadangannya? udah dicadangkan tapi pas pindah device malah ga kebaca, aneh banget makin sini makin bobrok, dulu perasaan cadangkan pesan ga sesusah sekarang, sekarang kenapa malah belibet banget, data jadi hilang semua",1,149,2.25.1.75,2025-01-31 15:10:16,,,2.25.1.75
62092a74-2a25-469d-9078-9c65cd91bd46,Badali Sad,https://play-lh.googleusercontent.com/a/ACg8ocLCKB4flKAmQV5BsaXFUp9MLGWvKbonUp8Vivr2YuGan0dCCA=mo,Apa ini? Bug lagi kah? Pas login ke whatsApp ngk bisa katanya haru menggunakan whatsApp resmi. Padahal udh resmi saya download di playstore ini. aneh sekali bugnya. Katanya bug nya udh di fix. Kok ada lagi bug nya? Sering kali udh di fix muncul lagi bugnya hadeh,1,78,2.25.2.85,2025-02-19 05:50:46,,,2.25.2.85
